<?xml version="1.0" encoding="utf-8" ?>
<!-- XML Schema generated by QTAssistant/XSD Module (http://www.paschidev.com) -->
<!-- from https://stackoverflow.com/questions/15770948/primary-and-foreign-keys-in-xml-schema -->
<xs:schema xmlns:xs="http://www.w3.org/2001/XMLSchema">
    <xs:element name="accounts">
        <xs:complexType>
            <xs:sequence>
                <xs:element ref="Account" maxOccurs="unbounded"/>   
                <xs:element ref="Password" minOccurs="0" maxOccurs="unbounded"/>
            </xs:sequence>          
        </xs:complexType>
        <xs:key name="PKAccounts"> <!--https://stackoverflow.com/questions/4491983/xml-schema-key-keyref-how-to-use-them-->
            <xs:selector xpath="Account/AccountID"/>
            <xs:field xpath="."/>
        </xs:key>
        <xs:key name="PKPasswords">
            <xs:selector xpath="Password/PasswordID"/>
            <xs:field xpath="."/>
        </xs:key>
        <xs:keyref name="FKAccountToPassword" refer="PKPasswords">
            <xs:selector xpath="Account/PasswordID"/>
            <xs:field xpath="."/>
        </xs:keyref>
    </xs:element>
    <xs:element name="Account">
        <xs:complexType>
            <xs:sequence>
                <xs:element name="Title" type="xs:string"/>
                <xs:element name="FirstName" type="xs:string"/>
                <xs:element name="LastName" type="xs:string"/>
                <xs:element name="Dateborn" type="xs:date"/>
                <xs:element name="Gender" type="xs:string"/>
                <xs:element name="AccountID" type="xs:string"/>
                <xs:element name="PasswordID" type="xs:string" minOccurs="0"/>
            </xs:sequence>
        </xs:complexType>
    </xs:element>
    <xs:element name="Password">
        <xs:complexType>
            <xs:sequence>
                <xs:element name="PasswordID" type="xs:string"/>
                <xs:element name="Street" type="xs:string"/>
                <xs:element name="City" type="xs:string"/>
                <xs:element name="Province" type="xs:string" minOccurs="0"/>
                <xs:element name="Country" type="xs:date" minOccurs="0"/>
                <xs:element name="PostalCode" type="xs:string" minOccurs="0"/>
            </xs:sequence>
        </xs:complexType>
    </xs:element>
</xs:schema>