<?xml version="1.0" encoding="utf-8" standalone="yes"?>
<!-- Sample XML generated by QTAssistant (http://www.paschidev.com) -->
<accounts xmlns:xsi="http://www.w3.org/2001/XMLSchema-instance"
xsi:noNamespaceSchemaLocation="accounts.xsd">
     <Account>
        <Title>Title1</Title>
        <FirstName>FirstName1</FirstName>
        <LastName>LastName1</LastName>
        <Dateborn>1900-01-01</Dateborn>
        <Gender>Gender1</Gender>
        <AccountID>AccountID1</AccountID>
        <PasswordID>PasswordID2</PasswordID>
    </Account>
    <Account>
        <Title>Title1</Title>
        <FirstName>FirstName1</FirstName>
        <LastName>LastName1</LastName>
        <Dateborn>1900-01-01</Dateborn>
        <Gender>Gender1</Gender>
        <AccountID>AccountID2</AccountID>
        <PasswordID>PasswordID1</PasswordID>
    </Account>
    <Password>
        <PasswordID>PasswordID1</PasswordID>
        <Street>Street1</Street>
        <City>City1</City>
        <Province>Province1</Province>
        <Country>1900-01-01</Country>
        <PostalCode>PostalCode1</PostalCode>
    </Password>
    <Password>
        <PasswordID>PasswordID2</PasswordID>
        <Street>Street1</Street>
        <City>City1</City>
        <Province>Province1</Province>
        <Country>1900-01-01</Country>
        <PostalCode>PostalCode1</PostalCode>
    </Password>
</accounts>